Title,Price,Availability
The Nameless City (The Nameless City #1),8.16,In stock
The Murder That Never Was (Forensic Instincts #5),4.11,In stock
The Most Perfect Thing: Inside (and Outside) a Bird's Egg,2.96,In stock
"The Mindfulness and Acceptance Workbook for Anxiety: A Guide to Breaking Free from Anxiety, Phobias, and Worry Using Acceptance and Commitment Therapy",3.89,In stock
The Life-Changing Magic of Tidying Up: The Japanese Art of Decluttering and Organizing,6.77,In stock
"The Inefficiency Assassin: Time Management Tactics for Working Smarter, Not Longer",0.59,In stock
The Gutsy Girl: Escapades for Your Life of Epic Adventure,7.13,In stock
The Electric Pencil: Drawings from Inside State Hospital No. 3,6.06,In stock
The Death of Humanity: and the Case for Life,8.11,In stock
"The Bulletproof Diet: Lose up to a Pound a Day, Reclaim Energy and Focus, Upgrade Your Life",9.05,In stock
The Art Forger,0.76,In stock
The Age of Genius: The Seventeenth Century and the Birth of the Modern Mind,9.73,In stock
The Activist's Tao Te Ching: Ancient Advice for a Modern Revolution,2.24,In stock
Spark Joy: An Illustrated Master Class on the Art of Organizing and Tidying Up,1.83,In stock
Soul Reader,9.58,In stock
Security,9.25,In stock
"Saga, Volume 6 (Saga (Collected Editions) #6)",5.02,In stock
"Saga, Volume 5 (Saga (Collected Editions) #5)",1.04,In stock
Reskilling America: Learning to Labor in the Twenty-First Century,9.83,In stock
"Rat Queens, Vol. 3: Demons (Rat Queens (Collected Editions) #11-15)",0.40,In stock
"Princess Jellyfish 2-in-1 Omnibus, Vol. 01 (Princess Jellyfish 2-in-1 Omnibus #1)",3.61,In stock
Princess Between Worlds (Wide-Awake Princess #5),3.34,In stock
"Pop Gun War, Volume 1: Gift",8.97,In stock
"Political Suicide: Missteps, Peccadilloes, Bad Calls, Backroom Hijinx, Sordid Pasts, Rotten Breaks, and Just Plain Dumb Mistakes in the Annals of American Politics",6.28,In stock
Patience,0.16,In stock
"Outcast, Vol. 1: A Darkness Surrounds Him (Outcast #1)",5.44,In stock
orange: The Complete Collection 1 (orange: The Complete Collection #1),8.41,In stock
Online Marketing for Busy Authors: A Step-By-Step Guide,6.35,In stock
On a Midnight Clear,4.07,In stock
Obsidian (Lux #1),4.86,In stock
My Paris Kitchen: Recipes and Stories,3.37,In stock
Masks and Shadows,6.40,In stock
"Mama Tried: Traditional Italian Cooking for the Screwed, Crude, Vegan, and Tattooed",4.02,In stock
"Lumberjanes, Vol. 2: Friendship to the Max (Lumberjanes #5-8)",6.91,In stock
"Lumberjanes, Vol. 1: Beware the Kitten Holy (Lumberjanes #1-4)",5.61,In stock
Lumberjanes Vol. 3: A Terrible Plan (Lumberjanes #9-12),9.92,In stock
"Layered: Baking, Building, and Styling Spectacular Cakes",0.11,In stock
Judo: Seven Steps to Black Belt (an Introductory Guide for Beginners),3.90,In stock
Join,5.67,In stock
In the Country We Love: My Family Divided,2.00,In stock
Immunity: How Elie Metchnikoff Changed the Course of Modern Medicine,7.36,In stock
"I Hate Fairyland, Vol. 1: Madly Ever After (I Hate Fairyland (Compilations) #1-5)",9.17,In stock
I am a Hero Omnibus Volume 1,4.63,In stock
How to Be Miserable: 40 Strategies You Already Use,6.03,In stock
Her Backup Boyfriend (The Sorensen Family #1),3.97,In stock
"Giant Days, Vol. 2 (Giant Days #5-8)",2.11,In stock
Forever and Forever: The Courtship of Henry Longfellow and Fanny Appleton,9.69,In stock
First and First (Five Boroughs #3),5.97,In stock
Fifty Shades Darker (Fifty Shades #2),1.96,In stock
Everydata: The Misinformation Hidden in the Little Data You Consume Every Day,4.35,In stock
"Don't Be a Jerk: And Other Practical Advice from Dogen, Japan's Greatest Zen Master",7.97,In stock
Danganronpa Volume 1,1.99,In stock
Crown of Midnight (Throne of Glass #2),3.29,In stock
"Codename Baboushka, Volume 1: The Conclave of Death",6.72,In stock
Camp Midnight,7.08,In stock
Call the Nurse: True Stories of a Country Nurse on a Scottish Isle,9.14,In stock
Burning,8.81,In stock
Bossypants,9.46,In stock
"Bitch Planet, Vol. 1: Extraordinary Machine (Bitch Planet (Collected Editions))",7.92,In stock
"Avatar: The Last Airbender: Smoke and Shadow, Part 3 (Smoke and Shadow #3)",8.09,In stock
Algorithms to Live By: The Computer Science of Human Decisions,0.81,In stock
A World of Flavor: Your Gluten Free Passport,2.95,In stock
"A Piece of Sky, a Grain of Rice: A Memoir in Four Meditations",6.76,In stock
A Murder in Time,6.64,In stock
A Flight of Arrows (The Pathfinders #2),5.53,In stock
A Fierce and Subtle Poison,8.13,In stock
A Court of Thorns and Roses (A Court of Thorns and Roses #1),2.37,In stock
(Un)Qualified: How God Uses Broken People to Do Big Things,4.00,In stock
You Are What You Love: The Spiritual Power of Habit,1.87,In stock
"William Shakespeare's Star Wars: Verily, A New Hope (William Shakespeare's Star Wars #4)",3.30,In stock
Tuesday Nights in 1980,1.04,In stock
Tracing Numbers on a Train,1.60,In stock
Throne of Glass (Throne of Glass #1),5.07,In stock
Thomas Jefferson and the Tripoli Pirates: The Forgotten War That Changed American History,9.64,In stock
Thirteen Reasons Why,2.72,In stock
The White Cat and the Monk: A Retelling of the Poem “Pangur Bán”,8.08,In stock
The Wedding Dress,4.12,In stock
The Vacationers,2.15,In stock
The Third Wave: An Entrepreneur’s Vision of the Future,2.61,In stock
The Stranger,7.44,In stock
